{
  "$schema": "../Schemas/dataset-manifest-v1.schema.json",
  "schemaVersion": 1,
  "manifestId": "librispeech-test-clean-other-smoke-100",
  "track": "smoke",
  "frozen": true,
  "normalizationVersion": "whisper-hotkey-wer-normalization-v1",
  "normalizationSha256": "2b76e7b39594da73f01f3fe7de0f3453852068db828976e344cee79a31599edb",
  "caseCount": 100,
  "source": {
    "name": "LibriSpeech test-clean and test-other",
    "url": "https://www.openslr.org/12/",
    "version": "OpenSLR 12 frozen repository selection",
    "termsUrl": "https://creativecommons.org/licenses/by/4.0/"
  },
  "license": "CC BY 4.0",
  "licenseVerified": true,
  "caseList": {
    "path": "../BenchmarkSuite/datasets/merged/librispeech-100/case_ids.txt",
    "sha256": "aad0550ac8a92e44163b0ed6f151c50c6cdeb6038ee843095b13c411835b1d5f"
  },
  "protectedSlices": ["read_speech", "test_clean", "test_other"],
  "requiredMetrics": ["normalizedWER", "displayWER", "cer", "latencyP50Ms", "latencyP95Ms", "latencyP99Ms", "peakRSSMiB"],
  "privacy": {
    "containsOrdinaryUserAudio": false,
    "containsTranscriptText": false,
    "redistribution": "licensed-fixture"
  }
}
